name=RTK_primaries;context=kanji;reversible=False;ordered=True,,,,,,,
,,481,背,9,ハイ,せ　　せい　　そむ・く　　そむ・ける,One's STATURE is measured according to the 'northern' -most 'part of the body'.
,,482,比,4,ヒ,くら・べる,"With a 'spoon' in each hand, a cooking show judge COMPARES two broths."
,,483,昆,8,コン,,"By 'comparing' themselves to the 'sun', ancient kings adduced that they were DESCENDED from it."
,,484,皆,9,カイ,みな,Imagine two homemakers 'comparing' the 'whiteness' of their linens in an ad for an ALL -temperature detergent.
,,485,楷,13,カイ,,"BLOCK LETTERS are like tidy rows of 'trees' that are 'all' the same size, so that they may easily be read by 'all'."
,,486,諧,16,カイ,,ORDERLINESS in oratory is having 'all' one's 'words' in good order.
,,487,混,11,コン,ま・ぜる　　ま・ざる　　ま・じる　　こ・む,"MIXED marriage, so a racist's logic goes, 'waters' down one's 'descendants'."
,,488,渇,11,カツ,かわ・く,Imagine a muchacho taking a 'siesta' ('sitting on the ground' 'bound up' in a poncho under the 'sun'). He appeals to you for 'water' to quench his THIRST.
,,489,謁,15,エツ,,Being in the AUDIENCE to hear the 'words' of an important speaker can be the perfect opportunity for a 'siesta'.
,,490,褐,13,カツ,,BROWN is the colour of the 'cloak' of a person having a 'siesta'.
,,491,喝,11,カツ,,"The muchacho having a 'siesta' opens his 'mouth', but his voice is too HOARSE to understand."
,,492,葛,11,カツ,くず,"KUDZU are crawling vines which can rise up from mere 'flowers' in the time it takes you to have a 'siesta'. The association of KUDZU with the warm, humid South of the US helps with the imagery."
,,493,旨,6,シ,むね,"If you find something DELICIOUS, consider spending a 'spoon' 'day' with it."
,,494,脂,10,シ,あぶら,"Too much 'delicious' food will add plenty of 'flesh' to make you FAT. Alternatively, FAT is the most 'delicious' 'flesh'."
,,495,詣,13,ケイ,もう・でる,"In the land of Znap, when one VISITS A SHRINE, one receives a 'delicious' bit of edible paper covered in sacred 'words'."
,,496,壱,7,イチ,,A 'samurai' 'sitting on the ground' wearing a 'crown' clearly believes they are number I (ONE).
,,497,毎,6,マイ,,Behind EVERY successful man 'lies' a woman - usually their 'mama'.
,,498,敏,10,ビン,,"Behind 'every' successful 'taskmaster', the CLEVERNESS of a fox."
,,499,梅,10,バイ,うめ,"Behind 'every' pie maker, a 'tree' full of PLUMS."
,,500,海,9,カイ,うみ,"Behind 'every' 'drop of water', a SEA from which it originated."
,,501,乞,3,,こ・う,Imagine someone 'lying down' in a public place boasting a 'hook' for a hand and BEGGING for a morsel.
,,502,乾,11,カン,かわ・かす　　かわ・く,"In times of DROUGHT, the victims 'beg' for a little 'mist' to relieve them."
,,503,腹,13,フク,はら,"If you 'double back' (fold over) an animal, you usually expose the 'part of the body' known as the ABDOMEN. (And 'doubling back' suggests a traveller doubling back to 'lie down' at the nearest wayhouse and rest their weary 'walking legs' after a long 'day' of travel.)"
,,504,複,14,フク,,"To DUPLICATE something means to 'double it back' with a fold, like the fold of a 'cloak'."
,,505,欠,4,ケツ,か・く　　か・ける,"This is a pictograph of someone yawning, indicating a LACK of sleep - or interest."
,,506,吹,7,スイ,ふ・く,To BLOW is to make one's 'mouth' 'lack' air.
,,507,炊,8,スイ,た・く,"When a novice COOK 'lacks' sufficient attention, a 'fire' is inevitable."
,,508,歌,14,カ,うた・う　　うた,"This SONG is being sung by a line of 'can' 'can' dancers - but the audience, impatient for the main act, are 'yawning'."
,,509,軟,11,ナン,やわ・らか　　やわ・らかい,"If one's 'car' seat is too SOFT, one might start 'yawning' - and soon thereafter, crashing."
,,510,次,6,ジ　　シ,つ・ぐ　　つぎ,"In the height of the summer, locals who 'lack' 'ice' queue up for their ration: the distributor cries, NEXT."
,,511,茨,9,,いばらr,"If you let your 'flowers' grow, 'next' they could turn into a BRIAR."
,,512,資,13,シ,,"The first 'shells' you earn go toward debts; the 'next' shell, though, becomes an ASSET."
,,513,姿,9,シ,すがた,This kanji depicts a 'woman's' FIGURE as a 'second' self.
,,514,諮,16,シ,はか・る,To seek the 'words' of a 'second' 'mouth' is to CONSULT WITH someone about something.
,,515,賠,15,バイ,,A 'muzzle' is like a 'vase' fixed over the 'mouth'. The COMPENSATION given to widowed Znapfian fishermen's wives was colloquially known as the 'clam' 'muzzle'.
,,516,培,11,バイ,つちか・う,"To CULTIVATE the 'soil' is to 'muzzle' it, just as one 'muzzles' a dog to tame it."
,,517,剖,10,ボウ,,"To DIVIDE and conquer, all you need is a 'saber' and a 'muzzle'."
,,518,音,9,オン　　イン,おと　　ね,The kanji for SOUND depicts something 'standing' over a 'tongue wagging in a mouth'.
,,519,暗,13,アン,くら・い,"When DARKNESS covered the earth long ago, there was neither 'sun' nor 'sound'."
,,520,韻,19,イン,,"A RHYME could be called a 'sound' 'employee' - used not merely for its meaning, but its aural qualities too."
,,521,識,19,シキ,,A person of DISCRIMINATING intellect can tell between mere 'kazoo' buzzing (aka the 'sound' of a 'fiesta') and 'words' spoken wisely.
,,522,鏡,19,キョウ,かがみ,"Polished 'metal' was once used for MIRRORS, which one 'stands up' on one's 'human legs' in front of, your 'tongue wagging in the mouth' as you ask who is the fairest of them all."
,,523,境,14,キョウ　　ケイr,さかい,The BOUNDARY of the paranoid farmer's 'land' is marked out with 'mirrors' to help him spot trespassers.
,,524,亡,3,ボウ　　モウr,な・い,"A 'top hat' left on its 'hook' suggests a man who is recently DECEASED - that is to say, a person who has *perished."
,,525,盲,8,モウ,,Deceased' 'eyes' make you BLIND.
,,526,妄,6,モウ　　ボウ,,The ideal 'woman' is no more than a DELUSION; hence 'perish' the thought of her.
,,527,荒,9,コウ,あら・い　　あ・らす　　あ・れる,The 'flowers' that 'perish' in the 'flood' symbolise a region LAID WASTE to.
,,528,望,11,ボウ　　モウ,のぞ・む,"AMBITION is the picture of a 'king' walking under a 'perishing' (waning) 'moon', coming up with plans for the future."
,,529,方,4,ホウ,かた,"Spin a 'dagger' atop a 'top hat' to indicate a randomised DIRECTION, like a *compass."
,,530,妨,7,ボウ,さまた・げる,A society under a 'woman's' 'direction' would DISTURB the patriarchal status quo.
,,531,坊,7,ボウ　 ボッr,,"The character for BOY shows a BOY scout cleaning 'dirt' out of his 'compass'; or alternatively, a BOY heading out in the 'direction' of 'dirt' as they are wont to."
,,532,芳,7,ホウ,かんば・しい,Something that is PERFUMED uses the scent of 'flowers' to 'direct' the attention of passersby.
,,533,肪,8,ボウ,,Someone who is OBESE might acquire so much 'flesh' that a 'compass' would be needed to navigate them.
,,534,訪,11,ホウ,おとず・れる　　たず・ねる,"When you CALL ON someone important, you must use 'compass' 'words' that are meticulously 'directed'."
,,535,放,8,ホウ,はな・す　　はな・つ　　はな・れる　　ほう・る,The 'taskmaster' takes only a quick glance at their 'compass' before choosing a 'direction' to boot their recently SET FREE slave towards.
,,536,激,16,ゲキ,はげ・しい,"Some VIOLENT 'taskmaster' is responsible for the tragedy depicted here: 'white' 'water' foaming around a broken 'compass'. Or perhaps the 'taskmaster' belongs to the stricken vessel itself, having met a VIOLENT end."
,,537,脱,11,ダツ,ぬ・ぐ　　ぬ・げる,To UNDRESS is to expose the 'flesh' and tempt the 'devil' (the 'horny' 'teenager').
,,538,説,14,セツ　　ゼイr,と・く,"To the ignorant and superstitious, a perfectly good EXPLANATION can be dismissed as 'devil's' 'words'."
,,539,鋭,15,エイ,するど・い,"To the Amish, any 'metal' that has been POINTED belongs as much to the 'devil' as man."
,,540,曽,11,ソウ　　ゾr,,A person who was FORMERLY Prime Minister may use their 'horned' 'brain' and 'tongue-wagging mouth' to sow all sorts of political discord. Has the primitive meaning of *increase (derived from the kanji for 'increase').
,,541,増,14,ゾウ,ふ・える　　ふ・やす　　ま・す,This kanji depicts how land that was 'formerly' worthless 'dirt' can rapidly INCREASE in value (the Znapfians were famed property speculators).
,,542,贈,18,ゾウ　　ソウr,おく・る,"Imagine, instead of the usual PRESENTS, you are gifted a mere, miserly dollar bill (a 'shell') - which soon magically 'increases' in value through shifting exchange rates."
,,543,東,8,トウ,ひがし,The EAST is a picture of the 'sun' rising through the 'trees'.
,,544,棟,12,トウ,むね　　むなr,A house's RIDGEPOLE is carved from a single 'tree' and oriented toward the 'east' to maximise sunlight throughout the day.
,,545,凍,10,トウ,こお・る　　こご・える,"In the land of Znap, the FROZEN land to the 'east' was known as the 'icy' 'east'."
,,546,妊,7,ニン,,A PREGNANT 'woman' is like a 'porter' for her child (and 'porter' reminds us of the mere 'drop' of weight carried by the 'samurai' compared to their servant).
,,547,廷,7,テイ,,The 'porters' of justice that run our COURTS too often 'stretch' the law to suit their purposes.
,,548,染,9,セン,そ・まる　　そ・める　　し・み　　し・みる,"A DYE is the 'water' of 'nine' 'trees' - the colourful essence of a variety of plants, one for each colour plus black and white."
,,549,燃,16,ネン,も・える　　も・やす　　も・す,A BURN is the 'sort of thing' you might get if you stray too close to the 'hearth'.
,,550,賓,15,ヒン,,"In the land of Znap, on the occasion of a visit by a VIP to one's 'house', someone must be sent to the 'ceiling' to get a 'few' 'shells' to offer up (naturally such visits are most unwelcome!)"
,,551,歳,13,サイ　　セイr,,"The traditional YEAR-END 'march' of the 'little' ones (chiefly children and dwarfs) is a chance to 'stop' and reflect on the 'little' things that make the 'march' of time bearable. (Alas the march was recently 'stopped' because it was condescending to dwarfs - and children, for that matter)."
,,552,県,9,ケン,,The feared police PREFECTURES of Znap are known for applying tiny 'little' 'fishhooks' to suspects' 'eyes' to extract an admission of guilt.
,,553,栃,9,,とち,The best environment for growing HORSE CHESTNUTS is in heavily wooded 'cliff' sides bedecked with 'ten thousand' 'trees' (remember 'ten thousand' is Japanese for any arbitrarily huge number).
,,554,地,6,チ　　ジ,,"In Znapfian mythology, the first GROUND was the 'soil' on the back of an enormous 'scorpion' flying through space."
,,555,池,6,チ,いけ,"In honour of Aesop's legend, the POND is named the 'water' of the 'scorpion' (the ill-fated frog is nowhere to be seen)."
,,556,虫,6,チュウ,むし,"This pictograph depicts an INSECT, wings a-flutter, perched on a little branch."
,,557,蛍,11,ケイ,ほたる,"This 'schoolhouse' is so poor it is lit by captured 'insects' - LIGHTNING BUGS, to be exact."
,,558,蛇,11,ジャ　　ダ,へび,"The kanji for SNAKE tells the story of an 'insect' which approached a 'house', luring an innocent SNAKE inside who was then beaten to death with a 'spoon'."
,,559,虹,9,,にじ,Znapfians believed that RAINBOWS were 'crafted' by 'insects' shuttling back and forth in the sky after rain.
,,560,蝶,15,チョウ,,"Before caterpillars were discovered, Znapfians saw BUTTERFLY cocoons and assumed it was an 'insect' that spontaneously 'generated' from a 'tree'."
,,561,独,9,ドク,ひと・り,To be a SINGLE man is to live in the company of 'wild dogs' and 'insects'.
,,562,蚕,10,サン,かいこ,The SILKWORM is so prized that its kanji describes 'heaven' opening up to release the priceless 'insect'.
,,563,風,9,フウ　　フr,かぜ　　かざr,"The kanji from which WIND derives represents a horde of 'insects' like 'drops' in the 'wind' - a plague of locusts, the most terrifying wind there is!"
,,564,己,3,コ　　キ,おのれ,"The pictograph for *snake is the kanji for SELF, imagined as a serpentine creature coiling up inside you."
,,565,起,10,キ,お・きる　　お・こす　　お・こる,"A boy was once so eager to ROUSE his parents on Christmas that he cried 'run' - 'snake', which got them out of bed in a hurry."
,,566,妃,6,ヒ,,The misogynist Znapfians had a word for QUEENS - 'woman' 'snakes'.
,,567,改,7,カイ,あらた・まる　　あらた・める,"The goal of the REFORMATION was to drive the 'snakes' from the Church, with Martin Luther as the 'taskmaster'."
,,568,記,10,キ,しる・す,"Overworked SCRIBES tend to put down their 'words' so sloppily that they curl all over the place like 'snakes', hence the moniker, 'word' 'snakes'."
,,569,包,5,ホウ,つつ・む,"The correct way to 'bind up' a 'snake' is to tightly WRAP it in linen. For the primitive, picture something which has a *snake coiled around it."
,,570,胞,9,ホウ,,Ancient midwives thought the PLACENTA was a 'blanket' used to 'wrap' the baby's 'flesh'.
,,571,砲,10,ホウ,,The barrel of a CANNON 'wraps' around the 'stones' that are its ammunition.
,,572,泡,8,ホウ,あわ,Legend tells of a drowning kid who was spared from the 'water' when he was magically 'wrapped' in a great BUBBLE.
,,573,亀,11,キ,かめ,"In Znapfian myth, a great TORTOISE was said to have once 'bound up' the 'two suns' beneath its shell - and only one of those suns was ever liberated. Try to picture the 'tail' threading through the 'suns' to keep them tied down. * Bottom half only signifies an 'eel'; with both 'suns', picture a * bucket of eels."
,,574,電,13,デン,,"The first observation of ELECTRICITY involved 'eels' in the 'rain', sizzling and crackling inadvertently to the wonder of early philosophers."
,,575,竜,10,リュウ,たつ,Superstitious Znapfians kept pickled 'eels' in translucent 'vases' and boasted that they were DRAGONS - hence the name 'vase' 'eel'.
,,576,滝,13,,たき,"The first WATERFALL was unleashed when a clumsy 'eel', unaware of its cumbersome length, disturbed an enormous 'vase' of 'water' (which had been set aside to water a god's hydrangeas)."
,,577,豚,11,トン,ぶた,PORK is of course 'flesh' of the 'sow'.
,,578,逐,10,チク,,The police ('sows') hit the 'road' to PURSUE a perp (maybe that poor escaping turtle from before!)
,,579,遂,11,スイ,と・げる,"Just picture a 'horned' 'sow' (a boar) hitting the 'road' on honeymoon, eager to CONSUMMATE a piggy marriage."
,,580,家,10,カ　　ケ,いえ　　や,The kanji for HOUSE defines a 'house' as the place you keep your 'sow'.
,,581,嫁,13,カ,よめ　　とつ・ぐ,"In Japan, a 'woman' leaves her own home to MARRY INTO her husband's 'house'."
,,582,豪,14,ゴウ,,"Think of the OVERPOWERING odour of the 'tall' 'crowned' 'sow', sovereign of all the piggy peoples."
,,583,腸,13,チョウ,,One Znapfian custom involved swallowing coins to feed the 'flesh' 'piggy bank' that was imagined to be your INTESTINES.
,,584,場,12,ジョウ,ば,The LOCATION of buried valuables is the 'soil' 'piggy bank'.
,,585,湯,12,トウ,ゆ,The avaricious Znapfians attended carefully to their 'piggy banks' - the 'water' provided to bathe the 'piggy bank' was often the only HOT WATER the family cared to boil!
,,586,羊,6,ヨウ,ひつじ,"A pictograph of a SHEEP, with little animal 'horns', a head, front and back legs, and the tail."
,,587,美,9,ビ,うつく・しい,Try to think of what the Chinese were on to when they associated the idea of BEAUTY with 'large' 'sheep'.
,,588,洋,9,ヨウ,,Think of all the poor 'sheep' tossed into the OCEAN as part of the live animal export business. No wonder it's known as 'water' of the 'sheep'.
,,589,詳,13,ショウ,くわ・しい,"A truly DETAILED essay uses only the finest 'words', tightly woven together like the fleece of an unshorn 'sheep'."
,,590,鮮,17,セン,あざ・やか,The Znapfian word for FRESH notes their two favourite foods: 'fish' and 'sheep'.
,,591,達,12,タツ,,"An assassin pulls up by the side of the 'road', hauls the body of a 'sheep' out of the boot and heaps a bit of 'soil' over it - another expertly ACCOMPLISHED hit."
,,592,羨,13,セン,うらや・ましい　　うらや・む,"In dry conditions, every 'sheep' jealously watches over its own patch of 'water'. Think of how ENVIOUS a 'sheep' would be who merely stands over a 'water' 'lack' - an empty puddle."
,,593,差,10,サ,さ・す,"In colonial Australia, nothing brought DISTINCTION to a man like proper 'wool' 'craft', i.e. the art of the shearer. (And 'wool' is a sheep with an extra stroke, as the tail is pulled to one side for shearing.)"
,,594,着,12,チャク　　ジャクr,き・る　　き・せる　　つ・く　　つ・ける,To DON one's clothes is to pull the 'wool' over your 'eyes'.
,,595,唯,11,ユイ　　イr,,"In the lead up to the holiday season, the best trimmings are SOLELY for the 'mouth' of the 'turkey' - since, in time, the 'turkey' will be SOLELY for the 'mouth' of its owners!"
,,596,堆,11,タイ,,"To inter a 'turkey', one must ensure the 'soil' is PILED HIGH."
,,597,椎,12,ツイ,,"Imagine maturing some Wild 'Turkey' in the wood of the SWEET OAK 'tree' for the sweetest, smoothest rye imaginable."
,,598,誰,15,,だれ,The 'word' of the 'turkey' is not gobble gobble but rather WHO.
,,599,焦,12,ショウ,こ・げる　　こ・がす　　こ・がれる　　あせ・る,Turkey' over an 'oven fire' is made to lightly CHAR. Delicious!
,,600,礁,17,ショウ,,"In the future, the word REEF will not be associated with colour and life but only 'charred' 'rocks'."
,,601,集,12,シュウ,あつ・まる　　あつ・める　　つど・う,The 'turkeys' GATHER in a 'tree' to devise their revenge.
,,602,准,10,ジュン,,"If hot 'turkey' makes a real Christmas lunch, 'iced' 'turkey' would make at best a QUASI- feast."
,,603,進,11,シン,すす・む　　すす・める,"Having devised their revenge, the 'turkeys' hit the 'road' in their remorseless ADVANCE upon humanity."
,,604,雑,14,ザツ　　ゾウ,,"The kanji for MISCELLANEOUS depicts an appropriately ad hoc mix: 'baseballs', 'trees', and 'turkeys' are all on display."
,,605,雌,14,シ,めす　　め,The FEMALE 'turkey' can be identified by its 'spoon' -shaped 'footprints.
,,606,準,13,ジュン,,"In the SEMI- finals of the 'water' 'turkey' competition, aspirants compete in the gruelling 'ten' -yard freestyle, which few 'turkeys' ever complete."
,,607,奮,16,フン,ふる・う,"In the popular Znapfian peasant dish, a 'St. Bernard dog', a 'turkey', and some 'brains' are all STIRRED UP."
,,608,奪,14,ダツ,うば・う,"Ancient Znap was plagued by thieving 'turkeys', who would sneak beneath the 'St. Bernard dog' on guard and 'glue' it down, allowing them to ROB the master with impunity."
,,609,確,15,カク,たし・か　　たし・かめる,"When you build your 'turkey coop' on a 'rock', you have ASSURANCE that it will not fall down. As ASSURED as a 'rock' 'turkey coop', my mother always said. (And a 'turkey coop' is a 'turkey' 'house', with the head of the turkey combined with the chimney of the house!)"
,,610,午,4,ゴ,,This pictograph of a *horse indicates NOON in the Chinese zodiac.
,,611,許,11,キョ,ゆる・す,To receive a PERMIT for something is to be given a 'word' 'horse' - a 'declaration' of a right which empowers you just as a 'horse' empowers a rider.
,,612,歓,15,カン,,"Remember Disney's Fantasia? In one scene, the 'flying horses' 'yawn' and pair off for the night - a portrait of DELIGHT. (And a 'flying horse' is a 'horse' crossed with a 'turkey', with the tail of the first and the head of the latter are combined into one stroke.)"
,,613,権,15,ケン　　ゴンr,,"The local AUTHORITY in my part of town is a 'pegasus' perched in a 'tree', which we've found to be an improvement over conventional council government."
,,614,観,18,カン,,"Who's OUTLOOK could be further afield than that of the 'pegasus', who 'sees' all from on high?"
,,615,羽,6,ウ,は　　はね,A pictograph of two bird *wings yields FEATHERS.
,,616,習,11,シュウ,なら・う,"If you wish to LEARN, uses the 'feathers' of a 'white bird' for your quill: everything you jot down will magically enter your memory."
,,617,翌,11,ヨク,,Hygienic birds put their 'feathers' in a 'vase' before bed so that they are in prime condition for THE FOLLOWING day.
,,618,曜,18,ヨウ,,"On a stressful WEEKDAY, busy 'turkeys' are wont to ruffle each others' 'feathers', hence the moniker 'day' of 'feathering' 'turkeys'."
,,619,濯,17,タク,,Imagine 'turkeys' doing their LAUNDRY - 'watering' their 'feathers' at the end of a hard day.
,,620,曰,4,,いわ・く,"Distingished from 'day' by its size, SAYETH refers to famous sayings by famous people and is the origin of the primitive 'tongue wagging in mouth'."
,,621,困,7,コン,こま・る,"Imagine a 'tree' all 'pent in', finding itself in a QUANDARY."
,,622,固,8,コ,かた・い　　かた・まる　　かた・める,"When carbon gets 'old' and 'pent in', it can HARDEN (into diamonds!)"
,,623,錮,16,コ,,To WELD two things together is to join them with a special 'metal' that 'hardens' when it cools.
,,624,国,8,コク,くに,"What is a COUNTRY but a way to 'pent in' all a people's 'jewels' to protect them from outsiders? Just imagine Australia and its rich wealth in 'jewels', all 'pent in' by the sea to safeguard them."
,,625,団,6,ダン　　トンr,,A taxonomic GROUP is a bunch of critters 'glued' to a backing board and all 'pent in' a box.
,,626,因,6,イン,よ・る,"The CAUSE of the mysterious knocked-over bins in your neighbourhood is a boisterous 'St Bernard dog', who is now 'pent in' to prevent a recurrence. Imagine how sad he is to be the CAUSE of so much distress."
,,627,姻,9,イン,,"In regressive societies, the harmonious state of MATRIMONY is a 'woman's' 'cause', much to the men's chagrin."
,,628,咽,9,イン,,"Ultimately it is the WINDPIPE that is the 'cause' of everything that comes out of your 'mouth'; likewise, the 'mouth's' primary 'cause' is to fill your WINDPIPE so you don't suffocate."
,,629,園,13,エン,その,"Imagine going to a dreary PARK in Hokkaido where everyone is 'pent in' by fences, huddled around a 'lidded crock' for a hot lunch, and wearing 'scarves' to fight the cold."
,,630,回,6,カイ　　エr,まわ・す　　まわ・る,How many -TIMES must you tell your annoying little brother to 'pent in' his 'mouth'?
,,631,壇,16,ダン　タンr,,"Lincoln in his iconic 'top hat' steps up to the PODIUM on the hallowed 'soil' of Gettysburg and says ""four-score '-times' ago..."" commemorating the 'nightbreak' of American democracy."
,,632,店,8,テン,みせ,The first STORES were nothing but 'fortune tellers' in 'caves' selling useless trinkets (and a 'cave' is a 'cliff' 'house').
,,633,庫,10,コ　　クr,,The very first WAREHOUSE in Japan was a 'cave' by the harbour filled to the brim with 'cars'.
,,634,庭,10,テイ,にわ,The first COURTYARD was no doubt a 'court' out the front of a 'cave'.
,,635,庁,5,チョウ,,"In the cavernous 'caves' that are GOVERNMENT OFFICES, troglodytic bureaucrats sign forms in triplicate and impale them on document 'spikes'."
,,636,床,7,ショウ,とこ　　ゆか,"The first BED was a 'tree' dragged into a 'cave' - an improvement upon sleeping on the stone floor, but only just."
,,637,麻,11,マ,あさ,"To hide one's HEMP plantation, it's best to put your 'grove' of marijuana plants in a 'cave' where no-one will think to look for them."
,,638,磨,16,マ,みが・く,"To GRIND a mix for a joint, use a 'hemp' 'stone'."
,,639,心,4,シン,こころ,"A pictographic representation of a HEART - see the curved valve and drops of blood? As a primitive: when beneath, the physical organ of the *heart; when to the left and abbreviated to three strokes, an emotional *state of mind; when beneath, where the top dot falls to the right side, it means *valentine."
,,640,忘,7,ボウ,わす・れる,Perish' my 'heart' if I should ever FORGET you.
,,641,恣,10,シ,,To be SELFISH is to be without the 'second' 'heart' that makes empathy possible.
,,642,忍,7,ニン,しの・ぶ　　しの・ばせる,To ENDURE is to feel the 'blade' in your 'heart' without flinching. This kanji is better felt than imagined.
,,643,認,14,ニン,みと・める,"When you ACKNOWLEDGE something someone tells you, you affirm that their 'words' will 'endure' with you."
,,644,忌,7,キ,い・む　　い・まわしい,"Cleopatra's MOURNING for Antony was so severe, she had a 'snake' applied to stop her 'heart'."
,,645,志,7,シ,こころざし　　こころざ・す,The 'heart' of the 'samurai' always perceives the INTENTION of a foe - and reacts accordingly.
,,646,誌,14,シ,,The first DOCUMENTS bore the 'words' signifying the 'intention' of one's daimyo - which had best be heeded if one is to avoid trouble...
,,647,芯,7,シン,,"Imagine taking a 'flower', stripping it down to its aromatic 'heart', and making a fragrant WICK out of it - delightful."
,,648,忠,8,チュウ,,To have LOYALTY is to keep another's interests right 'in' the middle of one's 'heart'.
,,649,串,7,,くし,A pictograph of two rectangular slabs of meat on a skewer.
,,650,患,11,カン,わずら・う,"To be AFFLICTED by, say, romantic jealousy, is to have a 'shish kebab' thrust through your 'heart' - a feeling we have surely all known at one time or other."
,,651,思,9,シ,おも・う,"To THINK is not merely to use one's 'brains', but also one's 'heart' whenever deciding things. Remember this wisdom and you will remember the kanji at the same time as making yourself a better person."
