name=RTK_primaries;context=kanji;reversible=False;ordered=True,,,,,,,
guest,"*house, each",315,客,9,キャク　　カク,,"When you are a GUEST in a courteous town, 'each' 'house' hold has its own way of welcoming you, and 'each' 'house' becomes your own."
forehead,"guest, *head",316,額,18,ガク,ひたい,"When a 'guest' is in, it is polite to avert your gaze upward toward the FOREHEAD - hence that part of the anatomy is known as the 'guest' 'head'."
summer,"*head, *walking legs",317,夏,10,カ　　ゲr,なつ,"In SUMMER, our 'heads' droop between our 'walking legs', or rather our 'dragging legs'."
dispose,"*walking legs, *wind",318,処,5,ショ,,"To DISPOSE of something, give it a good kick with your 'walking legs' and watch it sail away on the 'wind'."
twig,"*walking legs, tree",319,条,7,ジョウ,,Pinocchio had two 'tree' TWIGS for his 'walking legs'.
fall,"flower, water, each",320,落,12,ラク,お・ちる　　お・とす,"Each' thing FALLS in its own way - the 'blossom' wafting gently, the 'water' plopping noisily."
*crown,_primary,320a,,2,,,
superfluous,"*crown, *weather vane",321,冗,4,ジョウ,,A simple 'weather vane' has no need for a decorative 'crown' - it would be SUPERFLUOUS.
Hades,"*crown, day, six",322,冥,10,メイ　　ミョウ,,"The making of HADES was the 'crowning' achievement of the 'sixth' 'day' of creation, according to Znapfian mythology."
army; *chariot,"*crown, car",323,軍,9,グン,,"The 'crowned' 'vehicle' here depicts a *chariot, symbol of a great ARMY."
radiance,"ray, *chariot",324,輝,15,キ,かがや・く,The kanji for RADIANCE depicts a 'ray' emitted from a gleaming 'chariot'.
carry,"*chariot, *road",325,運,12,ウン,はこ・ぶ,"Swing low, sweet 'chariot', down our 'road', comin' for to CARRY me home."
*crown,"*crown, beginning, *glue",326,冠,9,カン,かんむり,The CROWN passing from one age to the next keeps the people 'glued' to their 'beginnings'.
dream,"flower, eye, *crown, evening",327,夢,13,ム,ゆめ,Flower' 'eyes' 'crown' the 'evening' - we could only be talking about a DREAM.
*top hat,_primary,327a,,2,,,
*whirlwind,"*top hat, *wind",327b,,4,,,
pit,"soil, *whirlwind",328,坑,7,コウ,,A 'whirlwind' drilling into the 'soil' will eventually dig a PIT.
tall,"*top hat, mouth, *hood, mouth",329,高,10,コウ,たか・い　　たか　　たか・まる　　たか・める,"An extraterrestrial swaps their 'hood' for a 'top hat', only to find it makes one conspicuously TALLER than one's fellow aliens. The two 'mouths' denote the two aliens in their respective headgear."
*tall,"tall, _over",329a,,5,,,
receive,"*tall, child",330,享,8,キョウ,,"Tall' 'children' RECEIVE more attention - and more nourishment - than others, hence their prodigious growth."
cram school,"receive, round, *dirt",331,塾,14,ジュク,,"At CRAM SCHOOL, the studious look longingly out the window onto the school 'grounds' at the 'tall' athletic kids and lazy 'fat' kids enjoying the afternoon in their respective fashions."
mellow,"receive, round, *flames",332,熟,15,ジュク,う・れる,The 'tall' and 'fat' kids are put on an 'oven fire' to MELLOW out and return to the typical life of a student.
pavilion,"*tall, *crown, *nail",333,亭,9,テイ,,"No World Expo PAVILION would be complete without a monstrous revolving restaurant - a 'tall' 'crowned' 'nail' blighting the skyline, though mercifully not for long."
capital,"*tall, little",334,京,8,キョウ　　ケイ,,Think of a CAPITAL and one thinks of 'tall' skyscrapers dwarfing 'little' people. The meeting of 'tall' and 'little' - that's the CAPITAL.
refreshing,"water, capital",335,涼,11,リョウ,すず・しい　　すず・む,"How REFRESHING is it when the 'water' (rains) come over the sultry 'capital' after a hot, crowded day."
scenery,"sun, capital",336,景,12,ケイ,,What could be more SCENIC than the 'sun' over the 'capital' city?
whale,"fish, capital",337,鯨,19,ゲイ,くじら,"The Znapfians imagine WHALES as 'fish' 'capitals', presuming all the swallowed 'fishes' get their act together."
*lidded crock,"soil, mouth",337a,,6,,,
cottage,"*umbrella, *lidded crock",338,舎,8,シャ,,"A 'lidded crock' under an 'umbrella' is an imaginative design for a modern COTTAGE, fusing old and new."
circumference; *lap,"*helmet, *lidded crock",339,周,8,シュウ,まわ・り,"Look closely at the lid of your 'lidded crock' and see little etchings, which you can use to find the CIRCUMFERENCE of your 'motorcycle helmet'. Has the added primitive significance of a *lap, say around an oval."
week,"*lap, *road",340,週,11,シュウ,,Picture a circular 'road' with seven markers - one 'lap' will circumscribe a WEEK.
gentleman; *samurai,"ten, *floor",341,士,3,シ,,"This kanji, with a shorter line at the bottom than the similar-looking 'soil', represents an upstanding GENTLEMAN - what in former times was a *samurai."
good luck; *aerosol can,"*samurai, mouth",342,吉,6,キチ　　キツ,,"Samurai' down on their luck used to stand on street corners with their 'mouths' wide open, bidding bystanders to slot coins inside for GOOD LUCK. As a primitive, the short bottom line gives the sense of a tightly sealed vessel like an *aerosol can."
robust,"*turtle, *samurai",343,壮,6,ソウ,,What could be more ROBUST than a 'turtle' turned 'samurai' (or perhaps 'ninja'?)
villa,"flower, *turtle, *samurai",344,荘,9,ソウ,,The VILLA pictured here boasts a garden of exotic 'flowers' guarded by 'robust' turtle samurai.
sell,"*samurai, *crown, *human legs",345,売,7,バイ,う・る　　う・れる,A 'samurai' out of work goes door-to-door selling clockwork toys: wind-up 'crowns' with frantic 'human legs'.
*schoolhouse,"*a drop of, *a drop of, *house",345a,,5,,,
study,"*schoolhouse, child",346,学,8,ガク,まな・ぶ,A 'child' in a 'schoolhouse' is expected to STUDY - whether they learn anything is another matter.
memorise,"*schoolhouse, see",347,覚,12,カク,おぼ・える　　さ・ます　　さ・める,One goes to a 'schoolhouse' to MEMORISE things by 'seeing' them repeatedly.
flourish,"*schoolhouse, tree",348,栄,9,エイ,さか・える　　は・え　　は・える,At the 'schoolhouse' it is hoped one will FLOURISH into a 'tree' of learnings.
*brush,_primary,348a,,6,,,
write,"*brush, *tongue wagging in the mouth",349,書,10,ショ,か・く,The act of WRITING is like attaching a 'brush' to your 'wagging tongue'.
haven,"water, *brush",350,津,9,シン,つ,"Seeing the tiny boats of poor mortals tossed in the stormy sea, the All-Merciful took its 'brush' and painted inlets of 'water' to provide safe HAVEN."
*taskmaster,_primary,350a,,4,,,
breed,"cow, *taskmaster",351,牧,8,ボク,まき,"When it's time to BREED new cattle, the 'taskmaster' forces the 'cow' into a compromising position, so to speak."
aggression,"craft, *taskmaster",352,攻,7,コウ,せ・める,The special 'craft' of successful 'taskmasters' is AGGRESSION against their charges.
failure,"*clam, *taskmaster",353,敗,11,ハイ,やぶ・れる,The 'taskmaster' acknowledges the FAILURE of a 'clam' to open up and yield its contents.
a sheet of,"tree, *taskmaster",354,枚,8,マイ,,"A 'taskmaster' whips a 'tree', yielding SHEETS of bark as a byproduct."
happenstance,"old, *taskmaster",355,故,9,コ,ゆえ,"Like it or not, HAPPENSTANCE is the 'oldest' 'taskmaster' of them all, and the most relentless."
awe,"flower, phrase, *taskmaster",356,敬,12,ケイ,うやま・う,"Standing in AWE of someone, you are wont to use 'flowery' 'phrases', which your elocution 'taskmaster' labours in vain to beat out of you."
say; *saying; *speech; *words,"one, one, one, one, mouth",357,言,7,ゲン　　ゴン,い・う　　こと,"Of all the things you do with your 'mouth', to SAY things is the most challenging, hence the four lines of sound. Has the primitive meaning of *speech or *word."
admonish,"awe, *words",358,警,19,ケイ,,"When your superior ADMONISHES you, your 'awe' likely restricts you to meaningless honorifics, while your superior has the advantage of plain and direct 'words'."
plot,"*words, *needle",359,計,9,ケイ,はか・る　　はか・らう,"A book's PLOT comprises the 'words' that puncture the story like 'needles', threading its elements together."
elucidate,"*words, whole",360,詮,13,セン,,To ELUCIDATE something is to present it in 'words' that are 'whole'.
prison,"*a pack of wild dogs, *words, *chihuahua",361,獄,14,ゴク,,"This picture of a PRISON shows hardened criminals as a 'pack of wild dogs', separated from the vulnerable new inmate, a yapping 'chihuahua', only by the latter's frantic 'words'."
revise,"*words, *nail",362,訂,9,テイ,,"After completing a first draft, you REVISE it by nailing down your words, presumably with 'word' - 'nails'."
obituary,"*words, magic wand",363,訃,9,フ,,A great OBITUARY is an act of 'word' 'magic' that almost seems to bring the departed back to life.
chastise,"*words, *glue",364,討,10,トウ,う・つ,CHASTISEMENTS are the 'words' that most stick to us like 'glue'.
instruction,"*words, stream",365,訓,10,クン,,"INSTRUCTION denotes the 'words' that lead along the 'stream' to success (think of the etymology of the English word, which literally means 'pour into')."
imperial edict,"*words, seduce",366,詔,12,ショウ,みことのり,An IMPERIAL EDICT is little more than 'words' to 'seduce' the people to the emperor's personality cult. A Marxist surely coined this particular kanji.
packed,"*words, *aerosol can",367,詰,13,キツ,つ・める　　つ・まる　　つ・む,A 'word' that is PACKED with meaning must be sealed tight like an 'aerosol can' to prevent all that meaning from escaping.
tale,"*words, tongue",368,話,13,ワ,はなし　　はな・す,"Znapfians call TALES 'words' of the 'tongue', because they are so much better heard than read."
recitation,"*words, eternity",369,詠,12,エイ,よ・む,RECITATIONS help us bear the 'words' of yore into 'eternity'.
poem,"*words, Buddhist temple",370,詩,13,シ,,The first Japanese POEMS were 'words' of the 'Buddhist temple' - religious verse in praise of God.
word,"*words, I",371,語,14,ゴ,かた・らう　　かた・る,"Am 'I' separate from my WORDS? Yes, according to the reading of this kanji - 'words' on one side, 'I' on the other."
read,"*words, sell",372,読,14,ドク　　トク　　トウr,よ・む,"In this age of advertising, alas, most of the 'words' we READ are meant to 'sell' us something, hence this very modern kanji."
tune,"*words, *lap",373,調,15,チョウ,しら・べる　　ととの・う　　ととの・える,"A catchy TUNE is not merely a succession of notes, but one or more 'laps' of the 'words' that go with it."
discuss,"*words, inflammation",374,談,15,ダン,,"In almost every attempt to DISCUSS an issue, the fervor of one's convictions bursts forth as 'inflaming' 'words'. "
consent,"*words, young",375,諾,15,ダク,,The 'words' of the 'young' have no legal bearing without the CONSENT of their parents.
rebuke,"*words, meeting of butchers",376,諭,16,ユ,さと・す,Words' spoken at those infamous 'meetings of butchers' often take the tenor of REBUKES.
,,377,式,6,シキ,,"In former times, every warrior 'crafted' their own 'arrows' according to their own particular STYLE (so there would never be debate as to who shot what)."
,,378,試,13,シ,こころ・みる　　ため・す,"When TESTING a new 'style' for market, designers closely heed the 'words' of focus groups."
,,379,弐,6,ニ,,Two 'arrows' in a 'quiver' resemble the numeral II. Don't forget to draw all the horizontal lines first.
,,380,域,11,イキ,,"Ah, home on the RANGE! This kanji depicts a cowboy returning to his 'land' after a successful trip to market. He presses his 'mouth' against the 'floor' in gratitude, then enjoys a boisterous family 'fiesta'."
,,381,賊,13,ゾク,,"From the point of view of a BURGLAR, a 'fiesta' is but an opportunity to dust off the old lockpicking 'needles' and raid the family's 'shells' (i.e. cash). The shells naturally come first to our attention, with the lockpick below and the fiesta in the background."
,,382,栽,10,サイ,,"On a PLANTATION, a farmer invites her 'trees' to 'Thanksgiving' (a kind of 'land' 'fiesta')."
,,383,載,13,サイ,の・せる　　の・る,LOAD the 'cart' with bales for the beloved 'Thanksgiving' hay ride.
,,384,茂,8,モ,しげ・る,"After the 'parade' (the 'enclosed fiesta') of 'flowers' was called off, the unused blossoms became beautifully OVERGROWN (note that the 'flowers', in an exception, go on top, having escaped the 'parade')."
,,385,戚,11,セキ,,"Think of a 'parade' of disagreeable RELATIVES; how 'little' they boast 'above', so to speak."
,,386,成,6,セイ　　ジョウr,な・す　　な・る,"Thanks to a scheduling error, a 'parade' abruptly TURNED INTO a 'dagger' fight when the marchers happened upon on an unrelated mafia event."
,,387,城,9,ジョウ,しろ,"In this kanji, we see a mound of 'dirt' being magically 'turned into' a magnificent CASTLE (or was it all in one's imagination?)"
,,388,誠,13,セイ,まこと,The sure sign of SINCERITY is that one's 'words' are 'turned into' deeds.
,,389,威,9,イ,,What could be more INTIMIDATING to the patriarchy than the sight of 'women' on the 'march'? (and a 'march' is a 'parade' with 'singular' purpose)
,,390,滅,13,メツ,ほろ・びる　　ほろ・ぼす,"Picture a 'march' of 'flames' protesting the fire department, only to be DESTROYED (rather predictably) by 'water'."
,,391,減,12,ゲン,へ・らす　　へ・る,A 'march' of unquenchable 'mouths' will soon cause the 'water' supply to DWINDLE.
,,392,蔑,14,ベツ,さげす・む,"The 'march' of 'flowers' was REVILED by the conservative elites, who cast a baleful 'eye' over proceedings."
,,393,桟,10,サン,,The first SCAFFOLDS were erected to construct magnificent (parade) 'floats' out of mighty 'trees' (a 'float' is a 'fiesta' with two extra lines for the platform).
,,394,銭,14,セン,ぜに,Most common people only get precious COINS when the 'gold' is hurled at them from 'floats' by their betters.
,,395,浅,9,セン,あさ・い,An entourage of 'floats' going from place to place must be sure to ford in SHALLOW 'waters' to avoid disaster. Picture what would happen if they didn't!
,,396,止,4,シ,と・まる　　と・める,"A pictograph of the left *footprint represents STOP. Note the big toe, clearly broken, sticking out at a grotesque right angle."
,,397,歩,8,ホ　　ブ　　フr,あゆ・む　　ある・く,A 'few' 'footprints' indicates going for a WALK.
,,398,渉,11,ショウ,,To FORD a body of 'water' means to 'walk' across it.
,,399,頻,17,ヒン,,Imagine having one's 'head' 'walked' on REPEATEDLY - a horrible image.
,,400,肯,8,コウ,,Footprints' on the 'flesh' indicates AGREEMENT extorted by severe means.
,,401,企,6,キ,くわだ・てる,To UNDERTAKE a project is to take an idea floating like an 'umbrella' and 'stopping' it so it can take root.
,,402,歴,14,レキ,,"A school CURRICULUM is like the 'grove of trees' whose cycles of growth over the cliff captured the idea of a calendar - except here, the cycle is 'stopped', just as a CURRICULUM 'stops' the natural cycle of learning."
,,403,武,8,ブ　　ム,,The ancient WARRIOR plants his 'quiver' in the mud and vows to 'stop' his foes at any cost.
,,404,賦,15,フ,,"As the 'warrior' passes through town, a LEVY of 'shells' is paid...or extracted."
,,405,正,5,セイ　　ショウ,ただ・しい　　ただ・す　　まさ,A CORRECT path begins with 'one' good 'step'. Imagine Confucian teachers schooling a toddler in the correct way to walk. Would the baby ever take even 'one' 'step' after all that overzealous CORRECTION?
,,406,証,12,ショウ,,Words' that testify to the 'correctness' of some fact are called EVIDENCE.
,,407,政,9,セイ　　 ショウr,まつりごと,"POLITICS, ideally, is the art of 'correct' 'taskmastering'."
,,408,定,8,テイ　　ジョウ,さだ・か　　さだ・める　　さだ・まる,DETERMINATION is a homeowner 'mending' their 'house' - possibly without the prerequisite skills.
,,409,錠,16,ジョウ,,"A LOCK is an example of 'metal' 'determination'; like the old Znapfian fable of the 'metal' city gate which magically fused, manifesting the city's 'determination' to resist its attackers."
,,410,走,7,ソウ,はし・る,"RUNNING, they say, 'mends' the 'soil'."
,,411,超,12,チョウ,こ・す　　こ・える,A life of 'running' after 'seductions' is that which Buddha teaches one must TRANSCEND.
,,412,赴,9,フ,おもむ・く,"Like Moses with his 'divining rod' before the Red Sea, God proclaiming the Hebrews may PROCEED - 'running', of course."
,,413,越,12,エツ,こ・す　　こ・える,Two 'parades' strive to SURPASS each other by 'running' at speed from town to town.
,,414,是,9,ゼ,,One spends an entire 'day' 'mending' one sock so that it is done JUST SO.
,,415,題,18,ダイ,,A TOPIC is all the information under a 'heading' prepared 'just so'.
,,416,堤,12,テイ,つつみ,"The famous DIKES of the Netherlands are nothing but 'soil' arranged 'just so', with suitably Dutch precision."
,,417,建,9,ケン　　コンr,た・つ　　た・てる,"In order to BUILD something, draw out your plans with a 'brush' and 'stretch' them out to scale in reality."
,,418,鍵,17,ケン,かぎ,What is a KEY but the 'metal' that lets you into your 'building'?
,,419,延,8,エン,の・ばす　　の・びる　　の・べる,"To PROLONG their youthfulness, the Sona from Star Trek 'stretch' their skin and 'stop' it in place with clips, a 'little' bit at a time."
,,420,誕,15,タン,,The first NATIVITY was the 'prolongation' of the 'word' throughout history.
,,421,礎,18,ソ,いしずえ,A CORNERSTONE is a 'stone' demarcating the edge of a wildlife preserve (a 'zoo' in a 'grove').
,,422,婿,12,セイ,むこ,"What makes a man a BRIDEGROOM is a 'woman', her dowry of exotic animals (the 'zoo'), and a 'month' away (aka a honey 'moon')."
,,423,衣,6,イ,ころも,"What we see is a 'top hat' and beneath, a depiction of the folds of a GARMENT. Additional meanings *scarf or *cloak."
,,424,裁,12,サイ,さば・く　　た・つ,"Think of special 'garments' TAILORED for 'Thanksgiving' - in the form of costumes of the pilgrims, one assumes."
,,425,装,12,ソウ　　ショウ,よそお・う,The legendary 'turtle' 'samurai' were ATTIRED with special 'garments'.
,,426,裏,13,リ,うら,A spy disguises the eavesdropping 'computer' on his BACK through use of a 'top hat' and 'scarf'.
,,427,壊,16,カイ,こわ・す　　こわ・れる,"Once upon a time, a ghost was woven a 'garment' so fine it could fit through the 'eye of the needle'. Made corporeal by this new luxury wear, the ghost attempted to pass through a nearby apartment block and predictibly DEMOLISHED it, razing it to the 'ground'."
,,428,哀,9,アイ,あわ・れ　　あわ・れむ,A drunkard in a 'top hat' and filthy 'scarf' with one big 'mouth' wide open guzzling booze - that is the picture of PATHETIC.
,,429,遠,13,エン　　オンr,とお・い,"On the open 'road' you see a figure in the DISTANCE, looking almost like a 'lidded crock' with a 'scarf'."
,,430,猿,13,エン,さる,"This clever MONKEY has caught a 'pack of wild dogs' in a 'lidded crock', tied up with a lovely silk 'scarf' to gift to the dog-catcher."
,,431,初,7,ショ,はじ・め　　はじ・めて　　はつ　　そ・める　　うい,"In the world of 'cloak' and 'dagger', the FIRST TIME is always the hardest."
,,432,巾,3,キン,,A TOWEL is represented as a bolt of cloth wrapped around a pole.
,,433,布,5,フ,ぬの,"Think of lying on crisp new LINENS, with a pile of fresh 'towels' 'by your side'."
,,434,帆,6,ハン,ほ,A SAIL made of a 'towel' makes for a 'mediocre' vessel.
,,435,幅,12,フク,はば,A particularly 'wealthy' man was once so revered that evening his 'towel' was auctioned off to be hung in an entrance hall as a HANGING SCROLL.
,,436,帽,12,ボウ,,"To avoid the 'risk' (of 'sun' in the 'eyes'), one wraps a 'towel' around one's head as a makeshift CAP."
,,437,幕,13,マク　　バク,,A dirty 'towel' at the entrance to a 'graveyard' is the picture of the CURTAIN of death.
,,438,幌,13,,ほろ,A large 'towel' stretched overhead with a few of the 'sun's' 'rays' peeping through is like a beautiful forest CANOPY to the imaginative mind of a youngster.
,,439,錦,16,キン,にしき,The traditional Znapfian BROCADE was little more than a strip of 'white' 'towel' with some 'metal' scraps sowed in.
,,440,市,5,シ,いち,"In the steamy MARKET of Znap, the traditional costume is but a bath 'towel' (for pragmatism) and a 'top hat' (for style)."
,,441,柿,9,,かき,"In the middle of the grand 'market' of Znap, a great PERSIMMON 'tree' grew, its fat fruits so heavy they wreaked havoc on the stalls beneath."
,,442,姉,8,シ,あね,The ELDER SISTER is the 'woman' of the family traditionally expected to go to 'market' for food.
,,443,肺,9,ハイ,,"In Znap, the favourite 'part of the body' on sale in the 'market' is always the LUNGS."
,,444,帯,10,タイ,おび　　お・びる,The part of the 'apron' where the 'buckle' is found is the SASH.
,,445,滞,13,タイ,とどこお・る,A 'water' 'sash' is the favoured garment for those unfortunates doing laundry in the STAGNANT local pond.
,,446,刺,8,シ,さ・す　　さ・さる,THORNS are like a 'belt' of 'sabers' around a 'tree'.
,,447,制,8,セイ,,The Znapfians had a special SYSTEM for slaughtering 'cows' - hanging them up by 'belts' around their ankles and decapitating them with one swift 'saber' slash.
,,448,製,14,セイ,,The ubiquitous MADE IN label is a symbol of the 'systematisation' of the 'garment' industry.
,,449,転,11,テン,ころ・ぶ　　ころ・がる　　ころ・げる　　ころ・がす,"As the wheels of the 'car' REVOLVE, they kick up 'rising clouds' of dust."
,,450,芸,7,ゲイ,,The secret TECHNIQUE of turning a 'rising cloud' into a bouquet of 'flowers' is depicted here.
,,451,雨,8,ウ,あめ　　あまr,"A pictograph of RAIN: the top line is the sky, the frame is two clouds, and the four dots are water."
,,452,雲,12,ウン,くも,A mature CLOUD is made up of 'rising clouds' full of 'rain'.
,,453,曇,16,ドン,くも・る,Sun' and 'clouds' naturally gives us CLOUDY WEATHER.
,,454,雷,13,ライ,かみなり,"When the 'weather' is bad, and the THUNDER is booming, sheltering in a wet, exposed 'rice field' is a bad idea."
,,455,霜,17,ソウ,しも,FROST is a kind of 'inter-' 'weather' - require moistness and chill.
,,456,冬,5,トウ,ふゆ,Walking legs' on 'ice' pretty much describes WINTER.
,,457,天,4,テン,あめ　　あまr,The HEAVENS are where the 'ceiling' 'dog' (or was that Sky God?) dwells. Ironically has the primitive meaning of *witch.
,,458,妖,7,ヨウ,あや・しい,You are BEWITCHED by a 'woman' who is a 'witch'.
,,459,沃,7,ヨク,,"Suffering from drought, the farmers call on a 'witch' to conjure up 'water' for their crops and IRRIGATE them."
,,460,橋,16,キョウ,はし,The Grand BRIDGE of Znap is made of great 'trees' carved into the shape of 'angels'. (And an 'angel' is an 'alien' who is the 'mouth' of the 'heavens')
,,461,嬌,15,キョウ,,Associating a particularly ATTRACTIVE 'woman' with the word 'angel' should not be difficult.
,,462,立,5,リツ　　リュウr,た・つ　　た・てる,This picture of a *vase STANDING UP speaks for itself.
,,463,泣,8,キュウ,な・く,"Next time you CRY, try gathering your tears in a 'vase' so you can 'water' the garden with them."
,,464,章,11,ショウ,,The BADGE of the flower club is appropriately a 'sunflower' in a 'vase'.
,,465,競,20,キョウ　　ケイ,きそ・う　　せ・る,"Two 'teenagers' are here 'standing up' to each other, VYING for their peers' adulation."
,,466,帝,9,テイ,,"A truly inspiring SOVEREIGN is one who 'stands up', dons an 'apron', and pitches in with the dishes once in a while."
,,467,諦,16,テイ,あきら・める,RENUNCIATION is a 'sovereign' 'word' to the Buddhists.
,,468,童,12,ドウ,わらべ,"It would be JUVENILE to punish your defective 'computer' by 'standing' on top of it (and jumping up and down), yet many feel the urge to on occasion."
,,469,瞳,17,ドウ,ひとみ,Juvenile' plus the double-meaning of 'eye' gives us PUPIL.
,,470,鐘,20,ショウ,かね,A BELL was once cast of 'metal' so poor its ringing sounded like the bellowing of 'juveniles'.
,,471,商,11,ショウ,あきな・う,See the peddler 'standing' atop his 'motorcycle helmet'; the 'legs' and 'mouth' depict the essential tools for MAKING A DEAL.
,,472,嫡,14,チャク,,"The sexist Znapfians like to call a man's LEGITIMATE WIFE his 'antique' 'woman'. (And an 'antique' is a 'vase' and an 'old' 'motorcycle helmet', just like on American Pickers.)"
,,473,適,14,テキ,,What could be a less SUITABLE display case for your 'antiques' than the middle of the 'road'?
,,474,滴,14,テキ,しずく　　したた・る,"In ancient limestone caves, 'antique' 'water' DRIPS from the roof, having worked its way down over thousands of years."
,,475,敵,15,テキ,かたき,Everyone's first ENEMY in life is some form of 'antique' 'taskmaster' - a nasty old pedant with a cane and the will to use it.
,,476,匕,2,ヒ,さじ,This is a picture of a baby sitting down holding out a SPOON and asking to be fed. Has the primitive meaning of *sitting on the ground.
,,477,叱,5,シツ,しか・る,The word SCOLD conjures up images of 'sitting on the ground' while a superior runs off at the 'mouth' with you.
,,478,匂,4,,にお・う,Imagine capturing an AROMA by 'binding it up' with a 'spoon' - lovely!
,,479,頃,11,,ころ,"When a drunk family member busts out the old 'head' and 'spoon' trick, it's ABOUT THAT TIME to leave."
,,480,北,5,ホク,きた,"In the NORTHERN hemisphere, the cold wind comes from the NORTH. This pictograph shows two cold peasants 'sitting on the ground' with their backs against one another for warmth."
